,id,appStore,appName,version,updateTime,author,downloadUrl,icon,introduction,inList,platform,insertTime,keyword
0,1915,安智市场,广发证券开户,2.1.33,2020-07-08 00:00:00,广发证券股份有限公司,http://www.anzhi.com/dl_app.php?s=3228057&n=5,http://www.anzhi.com//icon.php?u=ZGF0YTR8aWNvbnwyMDE4MTF8MTN8b2QxdFNEMWpIUWFicDkxMVhRRTcwU1BvaUpiWk1KY0FoUXF5K092bG9YRjg5VjkzSDR5SzhEcz0=,广发证券开户是广发证券官方自主研发的股票开户软件，全程手机自助开户，只需3分钟、操作简单、信息安全，支持24小时开户服务，开户过程中不收取任何费用，让开户比想象中更简单！,否,安卓,2020-07-22 00:00:00,国信证券开户
1,1916,安智市场,广发证券易淘金,8.7.0.3,2020-06-10 00:00:00,广发证券股份有限公司,http://www.anzhi.com/dl_app.php?s=3222292&n=5,http://www.anzhi.com//icon.php?u=ZGF0YTN8aWNvbnwyMDE1MDR8MDh8b2Qxc0MzQnJGZ2FmclpweFhSRVdpbk8xNDlhZmI5VTY3UTJ1c2JPNnNBPT0=,广发证券易淘金，是广发证券专为广大股民打造的一款集股票开户、股票交易、股市行情、基金理财为一体的股票/证券/炒股/理财/投资/财经/金融软件，是深受广大股民欢迎的股票、炒股、理财平台。,否,安卓,2020-07-22 00:00:00,国信证券开户
2,1917,安智市场,平安证券,7.4.1.0,2020-07-10 00:00:00,平安证券,http://www.anzhi.com/dl_app.php?s=3228710&n=5,http://www.anzhi.com//icon.php?u=ZGF0YTV8aWNvbnwyMDE5MDN8MjB8b2Qxc0MzQmtCVWFZc29aNkhSSWcwQ1RwcGN2ZFBwOFVoUTYxOWVYa3AzRjg5VjkzSDR5SzhEcz0=,平安证券有限责任公司是中国平安（保险）集团股份有限公司旗下重要成员，前身为1991年8月创立的平安保险证券业务部，目前拥有平安财智投资管理有限公司，平安期货有限公司、中国平安证券（香港）有限公司，平安磐海资本有限责任公司共四家子公司。,否,安卓,2020-07-22 00:00:00,国信证券开户
3,1918,安智市场,同花顺股票开户,V7.32.01,2020-06-04 00:00:00,核新同花顺,http://www.anzhi.com/dl_app.php?s=3220781&n=5,http://www.anzhi.com//icon.php?u=ZGF0YTN8aWNvbnwyMDE2MTJ8MzB8b2Qxc0MzQmtGVkNWcjkxa1h3UTlrQ0h0dm8zWUFORmQ2d3E1OXUzdHpYWitoQmdyVnQ0PQ==,同花顺股票开户是国内领先的互联网开户平台，提供30多家优质券商。我们支持24小时随时随地开户，开户过程中不收取任何费用，让开户比想象中更简单！,否,安卓,2020-07-22 00:00:00,国信证券开户
4,1919,安智市场,兴业证券优理宝,5.7.5,2020-06-25 00:00:00,兴业证券股份有限公司,http://www.anzhi.com/dl_app.php?s=3225707&n=5,http://www.anzhi.com//icon.php?u=ZGF0YTJ8aWNvbnwyMDE2MDh8MjR8b2Qxc0MzQnBIa2ZTdVlwdVFrczUzeTNwaU5LY2J0eFI0dyt3bnVydnZERWl6VW89,兴业证券优理宝，懂投资，更懂你！,否,安卓,2020-07-22 00:00:00,国信证券开户
5,1920,安智市场,平安自助开户,5.1.6,2020-04-22 00:00:00,平安证券,http://www.anzhi.com/dl_app.php?s=3211131&n=5,http://www.anzhi.com//icon.php?u=ZGF0YTN8aWNvbnwyMDE1MTB8MTZ8b2Qxc0MzQjRHRUdTcXBwaVZrc2swU2psdTRDRFBvWUd0VXJ1dFlLdDh4NTRuRnR4QXNuVXAwWS83cmhhcHc4Zw==,平安证券有限责任公司是中国平安（保险）集团股份有限公司旗下重要成员，前身为1991年8月创立的平安保险证券业务部，目前拥有平安财智投资管理有限公司，平安期货有限公司、中国平安证券（香港）有限公司，平安磐海资本有限责任公司共四家子公司。,否,安卓,2020-07-22 00:00:00,国信证券开户
6,1921,安智市场,安信手机证券,3.0.0,2018-08-22 00:00:00,essence,http://www.anzhi.com/dl_app.php?s=3023653&n=5,http://www.anzhi.com//icon.php?u=ZGF0YTR8aWNvbnwyMDE4MDd8MjR8b2QxdFNEMWpIUWFac29CeFhRWXNrRG40dUliR0FOeGM3UTYzOCszdHpYWitoQmdyVnQ0PQ==,安信手机证券，一款专为股票投资者打造的智能炒股软件。我们专注于提供极速的沪深港股市行情、安全的股票交易平台、稳健的基金理财产品，以及丰富的投资资讯等内容。,否,安卓,2020-07-22 00:00:00,国信证券开户
7,1922,安智市场,期货开户通,1.0.2.0,2019-07-12 00:00:00,国元期货有限公司上海营业部,http://www.anzhi.com/dl_app.php?s=3144663&n=5,http://www.anzhi.com//icon.php?u=ZGF0YTV8aWNvbnwyMDE5MDN8MDF8b2Qxc0MzQm5IRkNkcUlFNlNoQW8wQ3o1bzVEZk9wWTY0Z2k0K2VudG9uRVRuVnByUVpLRHRRPT0=,国元期货是经中国证监会批准设立的专业期货公司，注册资本6.09亿元，注册地北京。公司主要从事国内商品期货经纪、金融期货经纪、期货投资咨询、资产管理业务，是上海期货交易所、大连商品交易所、郑州商品交易所全权会员，中国金融期货交易所的交易结算会员，上海国际能源交易中心会员，可以代理交易并为客户结算国内目前所有上市的期货品种。国元期货APP是一款集成期货资讯、行情、交易、开户、客服为一体的移动终端智能应用系统，一款实用的金融理财软件，为您提供一个全面的理财！,否,安卓,2020-07-22 00:00:00,国信证券开户
8,1923,安智市场,国金证券佣金宝,5.05.001,2020-04-03 00:00:00,国金证券,http://www.anzhi.com/dl_app.php?s=3207312&n=5,http://www.anzhi.com//icon.php?u=ZGF0YTV8aWNvbnwyMDIwMDR8MDN8b2QxdFNEMWpIUWFicTRsbEhSd2ozSGpUNGRPVWFkTlI2Zy9mOXUvejRpOHJpQT09,佣金宝是国金证券于2014年推出的1+1+1证券服务产品，为投资者提供7x24小时证券账户开户服务，成功开户后享受证券交易普惠佣金率、闲置资金便捷理财及高品质咨询服务。佣金宝APP自上线以来，品质服务不断升级，从“全能证券服务终端”到“比你更懂你的炒股神器”，从“唯你·是从”的服务理念到“呈·人之美”的服务创新，逐步发展成为“全能”、“智能”、 “高效”、“贴心”的高品质证券服务终端，深受投资者好评。,否,安卓,2020-07-22 00:00:00,国信证券开户
9,1924,安智市场,东方证券期货,2.2.4,2020-07-13 00:00:00,东证期货,http://www.anzhi.com/dl_app.php?s=3229305&n=5,http://www.anzhi.com//icon.php?u=ZGF0YTV8aWNvbnwyMDIwMDN8MjN8b2Qxc0MzQm9DbG1VNzV4Nlh3d24yM3U5aU5HZWJkMVc3USt3bnVydnZERWl6VW89,东方证券期货APP是集工业品、农产品、股指期货、期权、黄金、白银、原油、贵金属等品种的期货开户、期货交易、期货行情、期货资讯、业务办理以及一对一客服等功能于一体的一站式投资服务平台，让每一位投资者都能享受安全、便捷、快速的期货投资服务。,否,安卓,2020-07-22 00:00:00,国信证券开户
10,1925,安智市场,佣金宝开户,2.02.005,2019-09-19 00:00:00,国金证券,http://www.anzhi.com/dl_app.php?s=3134146&n=5,http://www.anzhi.com//icon.php?u=ZGF0YTV8aWNvbnwyMDE5MDZ8MTF8b2QxdFNEMWpIUWFicTRsbEhSd2ozR1RudjdxVWFORlc0dzZ3OFlMcW9HODh4QTlu,佣金宝专用开户软件，提供7x24小时快速开户服务。成功开户后一律享受万2.5佣金率，支持一人多户，老股民也可以开新户。佣金宝是国金证券2014年2月推出的“1+1+1”证券服务产品，提供低佣金炒股、闲置现金理财和高品质咨询三大服务。佣金宝客户享受国金总部与全国营业部联动服务。,否,安卓,2020-07-22 00:00:00,国信证券开户
11,1926,安智市场,财通证券,V9.6.8,2020-06-23 00:00:00,财通证券,http://www.anzhi.com/dl_app.php?s=3225013&n=5,http://www.anzhi.com//icon.php?u=ZGF0YTV8aWNvbnwyMDE5MDV8MDF8b2Qxc0MzQmtGVkNWcjkxa1h3UTlrQ3ZpczVmQ05vRkxtVjdwdGJLejlSSXB5UjAzV0lpZHlDNC82S1FiK2xneVY0NHZIZFdoVnF3PQ==,财通证券APP是财通证券自主研发的移动端一站式理财平台。它不仅仅是一款手机炒股软件，还提供了各种理财咨询服务。行情交易极速安全、重大信息实时推送、理财产品一键购买，一站式服务尽在掌握。财通证券APP是您随身的证券助手，帮助您指点间把握稍纵即逝的投资机会。,否,安卓,2020-07-22 00:00:00,国信证券开户
12,1927,安智市场,中信手机开户,1.02.004,2016-01-06 00:00:00,中信证券股份有限公司,http://www.anzhi.com/dl_app.php?s=2495836&n=5,http://www.anzhi.com//icon.php?u=ZGF0YTN8aWNvbnwyMDE1MDd8MTN8b2Qxc0MzQjJDbHlHdGQxdVN4WXExU0xUNDlHZFp0eGM2Zy9mOXUvejRpOHJpQT09,一人可以开立多个证券账户，首选“中信证券手机开户”APP。该APP操作简便，用户下载后按照APP提示3-5分钟即可完成开户。中信证券7*24小时为您提供最优质高效的服务，助您股市掘金。\r\n						本站提供手机版中信手机开户下载,否,安卓,2020-07-22 00:00:00,国信证券开户
13,1928,安智市场,中信证券,5.5.1.25,2017-09-05 00:00:00,来自互联网,http://www.anzhi.com/dl_app.php?s=2845217&n=5,http://www.anzhi.com//icon.php?u=ZGF0YTN8aWNvbnwyMDE3MDl8MDV8b1lrelhqczdSeDdLODVaM1VGUjZpWDIvczlDVWI5MEF2QS9tcCtUb29pUis5VGR5QTlLTzUzNHE=,中信证券手机版安卓版客户端是中信证券自主设计的一款全新的集“行情、委托、资讯”为一体的客户端综合服务平台，相比一般的市场行情软件，中信证券手机版在行情数据、资讯信息、系统安全、个性定制、客户体验等方面，更加具有特色。                                                    \r\n						本站提供手机版中信证券下载,否,安卓,2020-07-22 00:00:00,国信证券开户
14,1929,安智市场,开源证券肥猫,3.04.005,2020-06-16 00:00:00,开源证券,http://www.anzhi.com/dl_app.php?s=3223425&n=5,http://www.anzhi.com//icon.php?u=ZGF0YTR8aWNvbnwyMDE4MDl8MjV8b2Qxc0MzQm5DVnVmcHBaNlJndzUxaVhpc3JxVmFkeFQ3QXF3OFlMcW9HODh4QTlu,开源证券肥猫理财APP,否,安卓,2020-07-22 00:00:00,国信证券开户
15,1930,安智市场,申万宏源开户,1.01.006,2015-01-26 00:00:00,申银万国证券股份有限公司,http://www.anzhi.com/dl_app.php?s=2058365&n=5,http://www.anzhi.com//icon.php?u=ZGF0YTJ8aWNvbnwyMDE1MDF8MjN8b2Qxc0MzQjJDbHlHdGQxblNoSXUxU0xUNU5TWWFkUlg2Zy9mOXUvejRpOHJpQT09,申万宏源赢家理财手机开户是申万宏源证券有限公司集专业技术、贴心客服针对iPhone、iPad打造的集资讯、投资者教育、开户等功能为一体的软件。,否,安卓,2020-07-22 00:00:00,国信证券开户
16,1931,安智市场,首创证券,5.7.2.4,2019-12-16 00:00:00,首创证券,http://www.anzhi.com/dl_app.php?s=3186053&n=5,http://www.anzhi.com//icon.php?u=ZGF0YTN8aWNvbnwyMDE1MDd8MTN8b2Qxc0MzQmtCVWFZc29aNkhSWTkwU25ub0l6RE1ZQVg5RXpqdTZ5Q3BYQjFtbEI4QWN5N29Dc21yUGhONnc9PQ==,首创证券5.7手机炒股客户端是首创证券在手机证券领域为客户提供更优质服务的又一扛鼎之作。此版本客户端在界面改造、自选功能、行情功能、交易功能和资讯服务等方面都进行了优化与升级，致力于为用户提供更为便捷的全方位移动金融理财服务。,否,安卓,2020-07-22 00:00:00,国信证券开户
17,1932,安智市场,证券从业资格题库,2.5.7,2020-07-20 00:00:00,帮考网,http://www.anzhi.com/dl_app.php?s=3230971&n=5,http://www.anzhi.com//icon.php?u=ZGF0YTV8aWNvbnwyMDIwMDR8MTB8b2QxdFNEeG5CM2VQcEpCaFFRdzkxeS8vaU5LWVp0TlM3QSt3bnVydnZERWl6VW89,应用描述：,否,安卓,2020-07-22 00:00:00,国信证券开户
18,1933,安智市场,天风股票开户,2.5.2,2020-07-07 00:00:00,天风证券,http://www.anzhi.com/dl_app.php?s=3227904&n=5,http://www.anzhi.com//icon.php?u=ZGF0YTJ8aWNvbnwyMDE2MDJ8MDF8b2Qxc0MzQjRHRUdTcXBwaVZrc2swU2psdTRDRFBvWUd0VXJ1dFlLcDlCNTBuVjk4Qk03VXAwWS83cmhhcHc4Zw==,介绍：天风证券官方出品的股票开户APP，上市券商品质。全程网上开户、信息安全、操作便捷！,否,安卓,2020-07-22 00:00:00,国信证券开户
19,1934,安智市场,证券从业资格题库,3.6.0,2018-06-13 00:00:00,启明题库,http://www.anzhi.com/dl_app.php?s=2992304&n=5,http://www.anzhi.com//icon.php?u=ZGF0YTN8aWNvbnwyMDE3MDR8MjR8b2Qxc0MzQjlIVnlWcW9ZNlVBUTkyeTNqcFp6a083cFVoUTJ3K09udnAzRjg5VjkzSDR5SzhEcz0=,启明教育重金打造“证券从业资格”考试题库。,否,安卓,2020-07-22 00:00:00,国信证券开户
20,1935,安智市场,大同证券,V9.00.05,2020-07-01 00:00:00,大同证券经纪有限责任公司,http://www.anzhi.com/dl_app.php?s=3226570&n=5,http://www.anzhi.com//icon.php?u=ZGF0YTN8aWNvbnwyMDE1MDl8MjN8b2Qxc0MzQmtGVkNWcjkxa1h3UTlrQ3ZpczVmQ05vRkxubDcwcnJPNndTUXYzeG9zUllXN29DNDg3S0FjK1ZoZFA0c3pROHVvRXc9PQ==,大同证券同花顺，是大同证券有限责任公司倾力打造的一款全面、专业的安卓移动终端，提供最及时的沪深港行情、便捷快速的交易和专业丰富的财经资讯。 特色功能： 最全交易：普通交易、信用交易、场外基金、货币基金、银行转账、交易查询应有尽有。 最全行情：支持AB股、基金、港股、美股、全球股指、期货、期货、外汇等，一览无余。 精彩资讯：最新最全股市热点、机会情报、板块概念、涨停揭秘！ 如果您对我们的服务有任何建议或意见，欢迎您与我们联系。 大同证券客服热线4007121212\r\n						本站提供手机版大同证券下载,否,安卓,2020-07-22 00:00:00,国信证券开户
21,1936,安智市场,中信证券,2.02.003,2017-08-28 00:00:00,中信证券股份有限公司,http://www.anzhi.com/dl_app.php?s=2840679&n=5,http://www.anzhi.com//icon.php?u=ZGF0YTN8aWNvbnwyMDE3MDh8Mjh8b2Q4NlYyNDlSeG5POXBkMkJWSjZqeS9vdE4yVVBvRmQ0d3JqOXVpOG95Ujc5VGR5QTlLTzUzNHE=,中信证券信E投是中信证券推出的一款面向投资者的炒股投资神器，全面改版更加出色。全方位支持各种证券业务，页面设计时尚流畅，更多自主人性化功能。软件具有首页、行情、交易、市场、我等五大功能模块。,否,安卓,2020-07-22 00:00:00,国信证券开户
22,1937,安智市场,开源股票开户,2.3.7,2019-08-21 00:00:00,开源证券,http://www.anzhi.com/dl_app.php?s=3156967&n=5,http://www.anzhi.com//icon.php?u=ZGF0YTJ8aWNvbnwyMDE2MDR8Mjh8b2Qxc0MzQjRHRUdTcXBwaVZrc2swU2psdTRDRFBvWUd0VXJ1dFlLMjZ4NS9tVnR5QmNUVXAwWS83cmhhcHc4Zw==,开源证券官方股票开户软件，支持7*24小时开户，操作简单便捷。,否,安卓,2020-07-22 00:00:00,国信证券开户
23,1938,安智市场,首创证券开户,2.0.1,2020-06-02 00:00:00,首创证券,http://www.anzhi.com/dl_app.php?s=3220300&n=5,http://www.anzhi.com//icon.php?u=ZGF0YTN8aWNvbnwyMDE1MDd8MDZ8b2Qxc0MzQjRHRUdTcXBwaVZrc2swU2psdTRDRFBvWUd0VXJ1dFlLdThTb2s5VjkxQU0vVnBTazRnNkVZNXhoc2I1cz0=,首创证券手机开户是我公司开发的高效安全便捷的开户应用。客户可以在3-5分钟内完成资金账户、证券账户、三方存管等账户开立及保证金关系的绑定。开户前客户需准备本人居民身份证及存管银行卡（有卡号即可）。\r\n						本站提供手机版首创证券开户下载,否,安卓,2020-07-22 00:00:00,国信证券开户
24,1939,安智市场,博尔证券量化交易系统,3.75,2020-06-10 00:00:00,上海兆吉信息技术有限公司,http://www.anzhi.com/dl_app.php?s=3222285&n=5,http://www.anzhi.com//icon.php?u=ZGF0YTR8aWNvbnwyMDE4MDl8Mjd8b2Qxc0MzQnVCVVNRb3B4NVZrczUxaVhpc3BYWUxJMDY3Z3V3OU83cG9uRVRuVnByUVpLRHRRPT0=,博尔量化APP又升级啦！这次我们为您带来了三组全新的量化数据，可以看到每个个股的「资金全景」。新数据需要解锁才能使用，请访问博尔量化官方（同名公众号）索取解锁办法。,否,安卓,2020-07-22 00:00:00,国信证券开户
25,1940,安智市场,雪盈证券,3.2,2020-07-17 00:00:00,北京雪盈信息技术有限公司,http://www.anzhi.com/dl_app.php?s=3230451&n=5,http://www.anzhi.com//icon.php?u=ZGF0YTR8aWNvbnwyMDE4MDh8Mjd8b2Qxc0MzQi9Ia2VMbzVKNFh3TWcwQ3ZpdElDRFBvc0JxRkRwcFlMcXBuZDdtVjUxQWFQVHBUZDRzdkVJ,雪盈证券是雪球集团成员企业。为用户提供全上线开户与交易服务，用户一个账户即可投资全球。尊享低佣低息，多重安全保障，直连雪球社区，追踪大V投资策略。,否,安卓,2020-07-22 00:00:00,国信证券开户
26,1941,安智市场,东方开户,3.2.32,2016-09-19 00:00:00,东方证券股份有限公司,http://www.anzhi.com/dl_app.php?s=2689603&n=5,http://www.anzhi.com//icon.php?u=ZGF0YTJ8aWNvbnwyMDE2MDl8MTl8b1lsblhqdzhFa3ZGOEpJbFVWUXMzSFBvdElhWmJZTlc3UW13b0x6czh5VjU5Vmg5Q2M3VHBDazRnNkVZNXdKeWI1cz0=,东方证券手机开户（普通版）是东方证券推出的一款手机应用，为您提供专业、便捷的移动自助开户服务。开户从此变得简单方便，免去了您前往营业部现场开立账户的烦扰。\r\n						本站提供手机版东方开户下载,否,安卓,2020-07-22 00:00:00,国信证券开户
27,1942,安智市场,2020证券从业考试,8.2,2020-07-13 00:00:00,四川掌云科技有限公司,http://www.anzhi.com/dl_app.php?s=3229111&n=5,http://www.anzhi.com//icon.php?u=ZGF0YTV8aWNvbnwyMDIwMDN8MzF8b2Qxc0MzQnJGMDJGcE4xL1VnbzYxaU9pclpUeWJOQlc2UWl3OGUyQ3BYTmkyZ1lpRXc9PQ==,《证券从业考试》是一款针对于在职人群、上班族的证券从业资格考试刷题软件。包含《金融市场基础知识》和《证券市场基本法律法规》两门考试科目的练习题目。,否,安卓,2020-07-22 00:00:00,国信证券开户
28,1943,安智市场,国泰君安开户,1.0,2016-03-01 00:00:00,国泰君安证券股份有限公司,http://www.anzhi.com/dl_app.php?s=2548924&n=5,http://www.anzhi.com//icon.php?u=ZGF0YTJ8aWNvbnwyMDE2MDN8MDF8b2RwZ0JUcHBGRXFZOUpWMkFRRjhpMzIwdHQyVWJvRUd1QTYzcCttNThYQXU5VGR5QTlLTzUzNHE=,国泰君安证券，股票开户，刷脸即开，快捷方便。,否,安卓,2020-07-22 00:00:00,国信证券开户
29,1944,安智市场,招商手机开户,5.2.1,2019-12-06 00:00:00,招商证券,http://www.anzhi.com/dl_app.php?s=3183618&n=5,http://www.anzhi.com//icon.php?u=ZGF0YTJ8aWNvbnwyMDE2MDV8MTZ8b2Qxc0MzQnZIVnVmcVpwNlVrc2kxaFcvNXQyZGFOSlY2bUMzOC9PdC9DWnU=,招商证券手机开户APP，支持个人客户的A股沪深证券账户开立及添加。真正做到7*24小时，想“开”就“开”；仅需三步（身份验证、开户申请、客户回访），极速开户，让客户做到开户“零等待”。系统支持多方式下载与登录、自动定位并推荐最近营业部、自动判断证件照片采集规范性、单向音视频验证客户身份、支持一人多户等功能。\r\n						本站提供手机版招商手机开户下载,否,安卓,2020-07-22 00:00:00,国信证券开户
30,1945,2345手机助手,证券开户,3.6.2,2019-07-24 00:00:00,海通证券股份有限公司,http://zhushou.2345.com/index.php?c=web&d=qrDown&softId=85453&type=1&uri=http%3A%2F%2Fapp.2345.cn%2Fappsoft%2F85453.apk,http://img1.2345.com/zhushouimg/img/logo/453/85453/1959568940.png,【新客专享】\r\n新客专享6%理财等你来\r\n【新体验】\r\n7*24小时开户，3分钟即可完成开户\r\n开户完成下载e海通财App畅享龙虎榜、闪电交易、股市日历等创新功能\r\n                                                        【更新日志】:海通证券开户APP助您轻松开户，7*24小时不间断服务，让您足不出户就能简单便捷快速完成开户，开户成功后下载e海通财APP，畅享新客理财、龙虎榜、闪电交易、股市日历等创新功能。,否,安卓,2020-07-22 00:00:00,国信证券开户
31,1946,2345手机助手,方正证券开户,0.1.27,2019-05-21 00:00:00,方正证券股份有限公司,http://zhushou.2345.com/index.php?c=web&d=qrDown&softId=54067&type=1&uri=http%3A%2F%2Fapp.2345.cn%2Fappsoft%2F54067.apk,http://img1.2345.com/zhushouimg/img/logo/67/54067/0505094940.png,该开户软件是方正证券自主研发的一款开户软件，为用户提供优质的开户体验。支持微信登陆、预设三方存管银行及银行网点，使开户流程变的简单、快速。\r\n使用步骤：\r\n1、下载并安装本软件\r\n2、直接打开即可使用\r\n                                                        【更新日志】:1、个人信息确认页增加详细地址选项\r\n2、增加图形验证码\r\n3、增加姓名和联系地址驳回项\r\n\r\n【微信公众号】：方正证券小方\r\n【方正证券官网地址】：www.95571.cn,否,安卓,2020-07-22 00:00:00,国信证券开户
32,1947,2345手机助手,南京证券开户,1.10,2019-07-02 00:00:00,南京证券股份有限公司,http://zhushou.2345.com/index.php?c=web&d=qrDown&softId=56586&type=1&uri=http%3A%2F%2Fapp.2345.cn%2Fappsoft%2F56586.apk,http://img1.2345.com/zhushouimg/img/logo/586/56586/1042311340.jpg,南京证券手机开户软件是我公司为服务广大安卓用户，联合专业团队，倾心打造的开户软件。\r\n   该软件主要包含拟开户营业部选择及个人影像上传、客户信息确认、公安部验证、视频见证、个人数字证书安装、账户开立及协议签署、密码设置、银行签约、风险测评、在线回访等环节。\r\n\r\n一、特色：\r\n1、便利：随时随地联网开户；\r\n2、简单：数字证书化，一扫手工签字的繁琐；\r\n3、快捷：直接拍照上传，整个过程只需短短几分钟；\r\n4、及时：交易时间提交的开户申请，当日即可反馈结果；非交易时间提交的开户申请，下一交易日反馈结果。\r\n\r\n二、开户条件：\r\n1、年龄在18-65周岁；\r\n2、有效期内的中华人民共和国第二代居民身份证；\r\n3、以本人身份证件开户的银行借记卡。\r\n                                                        【更新日志】:【更新】区分营销人员服务协议 \n【优化】修复bug,否,安卓,2020-07-22 00:00:00,国信证券开户
33,1948,2345手机助手,广发证券开户,2.1.9,2019-08-15 00:00:00,广发证券股份有限公司,http://zhushou.2345.com/index.php?c=web&d=qrDown&softId=58971&type=1&uri=http%3A%2F%2Fapp.2345.cn%2Fappsoft%2F58971.apk,http://img1.2345.com/zhushouimg/img/logo/971/58971/0436149220.png,广发证券开户是广发证券官方自主研发的股票开户软件，全程手机自助开户，只需3分钟、操作简单、信息安全，支持24小时开户服务，开户过程中不收取任何费用，让开户比想象中更简单！\r\n\r\n产品特色： \r\n1. 开户送大礼：开户即送Level-2，行情直连-快人一步、十档盘口-主力显形、逐笔成交-大单遁形！\r\n2. 开户更快：采用单向视频专项技术，3分钟快速股票开户，支持7*24小时办理！\r\n3. 开户更便捷：沪深A股账户、基金账户、统统一次搞定！\r\n4. 开户更专业：广发证券7000名专业顾问7*24小时在线服务，随时解答股票开户问题！ \r\n\r\n开户前准备： \r\n1. 下载开户APP，建议在WiFi或者3G/4G环境下使用。\r\n2. 身份证：在有效期内的本人二代身份证。\r\n3. 银行卡：请使用本人银行卡。\r\n                                                        【更新日志】:更新内容：App体验优化,否,安卓,2020-07-22 00:00:00,国信证券开户
34,1949,2345手机助手,爱建证券开户西南,3.2.1703201411,2017-05-12 00:00:00,爱建证券有限责任公司重庆火炬大道证券营业部,http://zhushou.2345.com/index.php?c=web&d=qrDown&softId=81508&type=1&uri=http%3A%2F%2Fapp.2345.cn%2Fappsoft%2F81508.apk,http://img1.2345.com/zhushouimg/img/logo/508/81508/1617595650.png,爱建证券介绍\r\n\r\n应用名称：爱建证券手机开户软件/爱建证券互联网开户\r\n应用包名：com.cairh.khapp.aijian.pro\r\n爱建证券手机开户软件是爱建证券专门针对网络客户开发的一款手机开户软件，从下载软件到开户成功只需3分钟左右，操作简单、信息安全，全程办理无阻碍，开户过程中不收取任何费用，感谢选择爱建证券。\r\n产品特色：\r\n1、方便：开户便捷、通畅，3分钟快速开户。\r\n\r\n2、省心：沪深A股账户、基金账户、一次性搞定\r\n\r\n3、专业：专人1对1的理财服务，为您投资生涯保驾护航\r\n\r\n4、省钱：开户默认无门槛佣金万分之2.5，为您节省更多的成本\r\n\r\n开户准备：\r\n1、身份证：本人有效期内的二代身份证\r\n\r\n2、银行卡：本人名下中国银行、工商银行、农业银行、建设银行、招商银行、交通银行、民生银行、华夏银行、兴业银行、平安银行、浦发银行、上海银行、宁波银行的借记卡，其中除建行和华夏以外其他均可一站式签约\r\n\r\n3、有前置和后置摄像头的手机或者PAD一台\r\n\r\n4、3G、4G网络或Wifi环境\r\n\r\n\r\n\r\n\r\n\r\n\r\n1、软件可能需要获取客户客户地理位置\r\n2、软件可能需要连接客户手机摄像头\r\n3、软件可能需要获取通讯录权限\r\n                                                        【更新日志】:当前所发布版本为，第4版本,否,安卓,2020-07-22 00:00:00,国信证券开户
