,id,appStore,appName,version,updateTime,author,downloadUrl,icon,introduction,inList,platform,insertTime,keyword
105,2020,360手机助手,华安手机开户,3.0.1,2020-05-08 00:00:00,华安证券股份有限公司,http://s.shouji.qihucdn.com/200508/f5a136fe54c8521849135b51e6fb1d26/com.thinkive.mobile.open.account.huaan_31.apk?en=curpage%3D%26exp%3D1596005148%26from%3Dopenbox_detail_index%26m2%3D%26ts%3D1595400348%26tok%3Daa42df86428660d23ff3e261f6d07405%26v%3D%26f%3Dz.apk,http://p15.qhimg.com/t01020a57d57c29bb49.png,足不出户，极速开户。华安手机开户APP是华安证券自主研发的轻体量、极速移动端手机开户软件，功能清晰易上手，为新入市的投资者提供7×24小时线上开户服务，客户可以快速下载，灵活利用碎片时间，免去临柜环节，只要身份证、银行卡、带有视频功能的手机便可随时随地极速开户。,否,安卓,2020-07-22 00:00:00,国信证券开户
106,2021,360手机助手,佣金宝开户,2.02.005,2019-06-12 00:00:00,国金证券股份有限公司,http://s.shouji.qihucdn.com/190612/81038cef755cb6f5b6f761dfb104fef0/cn.com.gjzq.yjb.kh_20190610.apk?en=curpage%3D%26exp%3D1596005148%26from%3Dopenbox_detail_index%26m2%3D%26ts%3D1595400348%26tok%3D5849b198e996f7714ddc30a295ac47e3%26v%3D%26f%3Dz.apk,http://p15.qhimg.com/t01e1981b63bbe0beeb.png,佣金宝专用开户软件，提供 7x24小时开户服务，手机快至百秒开户，成功开户后一律享受万2.5佣金率，支持一人多户，老股民也可以开新户。佣金宝是国金证券与腾讯战略合作后，证券行业率先推出的“1+1+1”互联网证券服务产品，提供低佣金炒股、闲置现金理财和高价值咨询三大服务。,否,安卓,2020-07-22 00:00:00,国信证券开户
107,2022,360手机助手,恒泰股票开户,3.3.8,2020-03-22 00:00:00,恒泰证券股份有限公司,http://s.shouji.qihucdn.com/200322/ace9960cea4bf5ae8e66df738a5b5597/com.cairh.khapp.aitui_2003181130.apk?en=curpage%3D%26exp%3D1596005148%26from%3Dopenbox_detail_index%26m2%3D%26ts%3D1595400348%26tok%3D35494022cd03a40f3c41aed80b6f1600%26v%3D%26f%3Dz.apk,http://p19.qhimg.com/t016d5a5349d17ac34f.png,恒泰股票开户是恒泰证券推出的一款专门用于开户的炒股准备软件。使用这款手机开户软件随时随地，足不出户就能完成证券开户，操作简单便捷。,否,安卓,2020-07-22 00:00:00,国信证券开户
108,2023,360手机助手,中信手机开户,1.02.018,2020-01-21 00:00:00,中信证券股份有限公司,http://s.shouji.qihucdn.com/200121/6aaea5fe11aede951bd0e82209439602/com.zztzt.zxsckh_20200120.apk?en=curpage%3D%26exp%3D1596005149%26from%3Dopenbox_detail_index%26m2%3D%26ts%3D1595400349%26tok%3Df98969bef9b8e6cba1ac147dd3844a4a%26v%3D%26f%3Dz.apk,http://p16.qhimg.com/t0119cad05ac14129b9.png,中信证券手机版客户端是中信证券自主设计的一款全新的集“行情、委托、资讯”为一体的客户端综合服务平台，相比一般的市场行情软件，中信证券手机版在行情数据、资讯信息、系统安全、个性定制、客户体验等方面，更加具有特色。,否,安卓,2020-07-22 00:00:00,国信证券开户
109,2024,360手机助手,东方证券期货,2.2.4,2020-07-13 00:00:00,上海东证期货有限公司,http://s.shouji.qihucdn.com/200713/6d0e7e14b8c53971238b255f4495627e/com.dzqh.online11_224.apk?en=curpage%3D%26exp%3D1596005149%26from%3Dopenbox_detail_index%26m2%3D%26ts%3D1595400349%26tok%3Dbb7fe51492939a2ce7f176f0c18ddb4c%26v%3D%26f%3Dz.apk,http://p17.qhimg.com/t01302407f2c049002d.png,东方证券期货APP是集工业品、农产品、股指期货、期权、黄金、白银、原油、贵金属等品种的期货开户、期货交易、期货行情、期货资讯以及一对一客服等功能于一体的一站式投资服务，让每一位投资者都能享受安全、便捷、快速的期货投资服务。,否,安卓,2020-07-22 00:00:00,国信证券开户
110,2025,360手机助手,财信证券开户,3.7.2020040100,2020-04-17 00:00:00,财信证券有限责任公司,http://s.shouji.qihucdn.com/200417/6f73b5ce2982597a9dd64020b331717d/com.cairh.khapp.caifu.svideo_2020040100.apk?en=curpage%3D%26exp%3D1596005149%26from%3Dopenbox_detail_index%26m2%3D%26ts%3D1595400349%26tok%3Ddb10541e7b57c9ffcbb75ebaf571a9c3%26v%3D%26f%3Dz.apk,http://p16.qhimg.com/t01db677481b1e1dbb6.png,财信证券开户APP，开户过程中不收取任何费用，保证信息安全，且提供7*24小时快速开户服务。,否,安卓,2020-07-22 00:00:00,国信证券开户
111,2026,360手机助手,,,,,,,,否,安卓,2020-07-22 00:00:00,国信证券开户
112,2027,360手机助手,华宝证券开户,9.6.2,2020-06-29 00:00:00,华宝证券有限责任公司,http://s.shouji.qihucdn.com/200629/68d3ed3da2d6abf166d8e2ade52f42ad/com.thinkive.android.hbtyb_38.apk?en=curpage%3D%26exp%3D1596005150%26from%3Dopenbox_detail_index%26m2%3D%26ts%3D1595400350%26tok%3Da09ca0310a1a3422b2ea0c98f5bf4ab2%26v%3D%26f%3Dz.apk,http://p19.qhimg.com/t01362d3c8a2f3fbd1e.png,华宝证券手机开户软件是华宝证券提供的互联网证券开户服务产品。无需预约，视频认证无需排队。为您提供便捷、高效、全方位自助式股票开户、场内基金开户服务。同时推出场内套利型货币基金产品—华宝添益，打造场内套利的互联网产品。,否,安卓,2020-07-22 00:00:00,国信证券开户
113,2028,360手机助手,Tiger Trade老虎证券美股港股炒股票,6.8.3.1,2020-07-10 00:00:00,TIGER BROKERS,http://s.shouji.qihucdn.com/200713/20ff7ee85a126ebbbb54efe18deced39/com.tigerbrokers.stock_6831.apk?en=curpage%3D%26exp%3D1596005150%26from%3Dopenbox_detail_index%26m2%3D%26ts%3D1595400350%26tok%3Db0b35cb5e2ba1bc9831ef31888358ef7%26v%3D%26f%3Dz.apk,http://p19.qhimg.com/t0134b3a5fd25353f27.png,———金钱永不眠———,否,安卓,2020-07-22 00:00:00,国信证券开户
114,2029,360手机助手,平安证券,7.4.1.0,2020-07-09 00:00:00,平安证券股份有限公司,http://s.shouji.qihucdn.com/200709/8bc3214ec277c3a516bca4b820cb3820/com.hundsun.winner.pazq_70410.apk?en=curpage%3D%26exp%3D1596005151%26from%3Dopenbox_detail_index%26m2%3D%26ts%3D1595400351%26tok%3D2ed83cc0cc4f49fd0ceae79ecc8073ae%26v%3D%26f%3Dz.apk,http://p15.qhimg.com/t01ce5ae071caebdfbe.png,平安证券有限责任公司是中国平安（保险）集团股份有限公司旗下重要成员。目前平安证券积极探索金融产品、技术和服务的改良创新，提供股票、基金、投资理财等多元化投资产品；及7*24小时认购，申购费率低至1折等创新服务。拥有完善的合规和风控体系，为国内主流券商之一.,否,安卓,2020-07-22 00:00:00,国信证券开户
115,2030,360手机助手,兴业证券优理宝,5.7.5,2020-06-27 00:00:00,兴业证券股份有限公司,http://s.shouji.qihucdn.com/200624/70835444e71089b55d27b873e29fdc0d/com.eno.xyzq.page_50705.apk?en=curpage%3D%26exp%3D1596005151%26from%3Dopenbox_detail_index%26m2%3D%26ts%3D1595400351%26tok%3D79975024da27a26a16dcff88f086599f%26v%3D%26f%3Dz.apk,http://p18.qhimg.com/t01aa3950ee40a21c75.png,兴业证券优理宝，懂投资，更懂你！,否,安卓,2020-07-22 00:00:00,国信证券开户
116,2031,360手机助手,财通证券,9.6.8,2020-06-22 00:00:00,财通证券股份有限公司,http://s.shouji.qihucdn.com/200623/36552585ef623e88e5bcb3842feb38ad/com.hexin.plat.android.CaitongSecurity_2062.apk?en=curpage%3D%26exp%3D1596005151%26from%3Dopenbox_detail_index%26m2%3D%26ts%3D1595400351%26tok%3Dff6062ac0c0beeab605bb7febd89005f%26v%3D%26f%3Dz.apk,http://p16.qhimg.com/t016c85ec099b6f178a.png,财通证券APP是财通证券自主研发的移动端一站式理财平台。它不仅仅是一款手机炒股软件，还提供了各种理财咨询服务。行情交易极速安全、重大信息实时推送、理财产品一键购买，一站式服务尽在掌握。财通证券APP是您随身的证券助手，帮助您指点间把握稍纵即逝的投资机会。,否,安卓,2020-07-22 00:00:00,国信证券开户
117,2032,360手机助手,中国银河证券,5.1.8,2020-07-16 00:00:00,中国银河证券股份有限公司,http://s.shouji.qihucdn.com/200716/f84f1cf945546853f4db455d3a7e8f79/com.galaxy.stock_2220.apk?en=curpage%3D%26exp%3D1596005152%26from%3Dopenbox_detail_index%26m2%3D%26ts%3D1595400352%26tok%3D528014490e73d7673d9c8f85aeb1ef4b%26v%3D%26f%3Dz.apk,http://p17.qhimg.com/t013247ab1640d2bc15.png,“中国银河证券”APP是我公司全新打造的新一代智能炒股理财软件，功能涵盖财富管理、银河优选、银河优顾、智能交易、资产全景、财富日历、智能客服等多个方面，新软件在快捷、安全的基础上，采用场景化业务设计理念，致力于为用户提供一站式专业化综合金融服务。,否,安卓,2020-07-22 00:00:00,国信证券开户
118,2033,360手机助手,华鑫证券股票开户,2.06.002,2020-04-22 00:00:00,华鑫证券有限责任公司,http://s.shouji.qihucdn.com/200422/6cd186c2fd267ed783b814d004814947/com.zztzt.hxsckh_20200421.apk?en=curpage%3D%26exp%3D1596005152%26from%3Dopenbox_detail_index%26m2%3D%26ts%3D1595400352%26tok%3D07de83e8cd9063a48fe9bbb29fbc46b0%26v%3D%26f%3Dz.apk,http://p19.qhimg.com/t01b3a25dce944f9e6f.png,华鑫证券有限公司是经中国证券监督管理委员会批准于2001年3月在深圳市注册成立的全国性综合类证券经营机构。公司秉承“规范、专业、创新”的企业文化，稳健经营。,否,安卓,2020-07-22 00:00:00,国信证券开户
119,2034,360手机助手,证券从业随身学,2.4.0,2020-06-22 00:00:00,北京对啊网教育科技有限公司,http://s.shouji.qihucdn.com/200622/c7aa509c204a24a8c220699ff3129a2f/com.onesoft.app.Tiiku.Duia.ZQSSX_240.apk?en=curpage%3D%26exp%3D1596005152%26from%3Dopenbox_detail_index%26m2%3D%26ts%3D1595400352%26tok%3Dd800fd173e1e5e6b98e8a79061c2b071%26v%3D%26f%3Dz.apk,http://p19.qhimg.com/t016882568e12bb32e3.png,证券从业考试推荐下载,否,安卓,2020-07-22 00:00:00,国信证券开户
120,2035,360手机助手,中信证券,3.03.025,2020-07-17 00:00:00,中信证券股份有限公司,http://s.shouji.qihucdn.com/200717/27832a118982f6890c6022f1293ef320/com.zxscnew_20200701.apk?en=curpage%3D%26exp%3D1596005153%26from%3Dopenbox_detail_index%26m2%3D%26ts%3D1595400353%26tok%3D4a6348e313f8fe347591d57dfafaa6df%26v%3D%26f%3Dz.apk,http://p18.qhimg.com/t0114528d0c6a3231eb.png,信e投是中信证券为投资者定制的投资神器。通过对金融科技的专注以及用户体验的追求，坚持以投资者利益为中心的理念，全方位实现各种证券业务，力争成为更多投资者信赖的券商App。,否,安卓,2020-07-22 00:00:00,国信证券开户
121,2036,360手机助手,同花顺炒股票,10.11.04,2020-07-13 00:00:00,浙江核新同花顺网络信息股份有限公司,http://s.shouji.qihucdn.com/200713/51db2cfa8e33ec5a6576dce17b41089e/com.hexin.plat.android_4513.apk?en=curpage%3D%26exp%3D1596005153%26from%3Dopenbox_detail_index%26m2%3D%26ts%3D1595400353%26tok%3Dec8bdce7b2886a48e75f1346feaa6920%26v%3D%26f%3Dz.apk,http://p16.qhimg.com/t01fa56456c209d3e95.png,同花顺(300033)上市十周年，幸得您一路相伴！未来投资之路，25年专业品质，继续为您保驾护航！,否,安卓,2020-07-22 00:00:00,国信证券开户
122,2037,360手机助手,光大证券开户,5.3.2,2019-04-22 00:00:00,光大证券股份有限公司,http://s.shouji.qihucdn.com/190422/54571f51ecc0357518ae10d2e9566202/com.thinkive.mobile.account_gd_15.apk?en=curpage%3D%26exp%3D1596005153%26from%3Dopenbox_detail_index%26m2%3D%26ts%3D1595400353%26tok%3Dd40d7a7cd89dc5f8069bbb679e59da88%26v%3D%26f%3Dz.apk,http://p16.qhimg.com/t014c37ebd0099a3895.png,由光大证券为您倾情打造的手机APP客户端开户应用，为您提供“一站式”便捷、高效的开户服务。此App仅提供快捷开户功能。开户前，请先准备好身份证正反面照片。开户过程中遇到任何问题都可以拨打光大证券客服热线95525寻求帮助。,否,安卓,2020-07-22 00:00:00,国信证券开户
123,2038,360手机助手,证券从业资格对题库,2.2.0,2020-01-16 00:00:00,北京对啊网教育科技有限公司,http://s.shouji.qihucdn.com/200116/dcca3a152638e6fb0fa120e139bc5edc/com.duia.offline_zq_qbank_220.apk?en=curpage%3D%26exp%3D1596005153%26from%3Dopenbox_detail_index%26m2%3D%26ts%3D1595400353%26tok%3D3e0ee61b069139caa32aa943947ebe6d%26v%3D%26f%3Dz.apk,http://p19.qhimg.com/t01fab13f674421322d.png,2020对啊证券从业资格证对题库将免费到底。让你轻松通关，绝地求生。,否,安卓,2020-07-22 00:00:00,国信证券开户
124,2039,360手机助手,证券从业资格准题库,4.50,2020-05-28 00:00:00,中大英才（北京）网络教育科技有限公司,http://s.shouji.qihucdn.com/200628/46aa1b046814da1cc5c8066babd04b57/cn.wangxiao.zqzhuntiku_50.apk?en=curpage%3D%26exp%3D1596005154%26from%3Dopenbox_detail_index%26m2%3D%26ts%3D1595400354%26tok%3D672a91eed0007e5c01b88e8bd8009404%26v%3D%26f%3Dz.apk,http://p18.qhimg.com/t01f3ab6ca9091d0ec0.png,2020年证券从业资格备考推荐,否,安卓,2020-07-22 00:00:00,国信证券开户
125,2040,360手机助手,证券从业资格题库,2.5.7,2020-07-20 00:00:00,重庆帮考教育科技有限公司,http://s.shouji.qihucdn.com/200720/0a1c62d1efbc3c06cf8edf7011cdbdba/cn.bkw_securities_45.apk?en=curpage%3D%26exp%3D1596005154%26from%3Dopenbox_detail_index%26m2%3D%26ts%3D1595400354%26tok%3Df937eb935159949d5616f9369c181a73%26v%3D%26f%3Dz.apk,http://p18.qhimg.com/t0161f9fb7ced3ce07d.png,职业资格考证刷题利器，考试必备！帮考网专注题库培训十年，多次多次荣获全国十大网络教育机构等荣誉称号，名副其实的中国考试题库专家。,否,安卓,2020-07-22 00:00:00,国信证券开户
126,2041,360手机助手,湘财证券,1.28,2020-07-10 00:00:00,湘财证券股份有限公司,http://s.shouji.qihucdn.com/200709/f650b86c0b3f1997479f4d57f8878982/com.xcsc.tdxapp_128.apk?en=curpage%3D%26exp%3D1596005154%26from%3Dopenbox_detail_index%26m2%3D%26ts%3D1595400354%26tok%3D1672e9b3561e364232e05f7db2adec5d%26v%3D%26f%3Dz.apk,http://p16.qhimg.com/t018d800a70aa842ae7.png,湘财证券百宝湘APP是我公司全新打造的新一代一站式智能金融服务平台，在极速行情数据、高效交易体验、智能投资工具、专属服务体系、综合资产配置等多元化业务领域快速布局，新平台在快捷、安全的基础上，采用场景化业务设计理念，致力于为用户提供一站式专业化综合金融服务。基于在金融科技领域的创新能力和突出表现，湘财证券百宝湘APP荣膺券商中国“2018券商APP创新突破奖”。,否,安卓,2020-07-22 00:00:00,国信证券开户
127,2042,百度手机助手,中泰齐富通,5.13.1549,,,http://gdown.baidu.com/data/wisegame/dfb0232cd848b4e5/b1dddfb0232cd848b4e5191263a54042.apk,http://gdown.baidu.com/img/0/512_512/cadb269a28f7eb69326ca97d42c65bee.png,中泰齐富通是中泰证券(原齐鲁证券)旗下为广大投资者打造的集证券开户、股票交易、股票行情、投资资讯、业务办理等多功能于一体的证券投资平台。中泰证券是大型综合类券商，获评券商中国“中国最贴心券商”和“中国最具人气券商”【主要功能】1)证券开户：7*24小时在线3分钟极速开户2)股票交易：闪电下单，提供基金、融资融券、港股通(沪深)、新三板等多品种交易服务3)股票行情：l...,否,安卓,2020-07-22 00:00:00,国信证券开户
128,2043,百度手机助手,金太阳,5.6.1,,,http://gdown.baidu.com/data/wisegame/dbf4df1890b07f59/d544dbf4df1890b07f59bec017804d72.apk,http://gdown.baidu.com/img/0/512_512/c25cad9e79b383c7aaa3f0e839dc890a.png,金太阳是由国信证券自主研发的一款一站式金融投资理财软件。让您随时随地掌握证券行情、了解财经资讯、进行证券交易，是您随身的投资工具和理财伙伴。【亮点】1、丰富便捷：简洁界面，丰富的产品，快捷入口，场景化引导，可视化数据及资产分析，让您准确了解大盘趋势，股票交易更快速安全；2、极速行情：左右滑动快速切换行情，调整数据信息更简洁，支持两融标的便捷操作，股票行情体验更流畅；...,否,安卓,2020-07-22 00:00:00,国信证券开户
129,2044,百度手机助手,万联证券股票开户,3.3.8,,,http://gdown.baidu.com/data/wisegame/8bf3ca8f9ba4951e/wanlianzhengquangupiaokai_1912081600.apk,http://gdown.baidu.com/img/0/512_512/37adf16368c6d2efd8fdc0dc854029ea.jpg,万联证券官方推出的一款手机炒股开户软件，为您提供安全、便捷的网上证券开户服务。免费开立沪深A股证券账户，尊享佣金费率万分之2.5，免费体验level-2增强行情，助您掘金大牛股！万联证券是国有全牌照证券公司，为广大投资者提供包括股票开户、股票交易、股市行情、基金理财、财富管理在内的证券/股票/炒股/理财/投资/财经/金融服务，是超百万股民共同的选择！【特色功能】 1、安全：...,否,安卓,2020-07-22 00:00:00,国信证券开户
130,2045,百度手机助手,华西证券股票开户,3.8,,,http://gdown.baidu.com/data/wisegame/170ddd8b23eec92e/huaxizhengquangupiaokaihu_20180720.apk,http://a.hiphotos.bdimg.com/wisegame/wh%3D512%2C512/sign=39ac7043dca20cf446c5f6da473b6703/622762d0f703918fc0c2ca0e5d3d269758eec4e7.jpg,华西证券股票开户是华西证券官方出品的手机自助开户软件，是一款面向具有股票投资需求的客户群体提供的证券开户软件，让客户足不出户，随时、随地、随心的开立证券账户，财富触手可及。     产品特色： 1、极速开户：十分钟内完成开户流程。 2、无需临柜：随时随地手机开立证券账户。 3、线下服务：全国75家营业网点提供优质的投资理财服务。 视频见证时段： ...,否,安卓,2020-07-22 00:00:00,国信证券开户
131,2046,百度手机助手,西南金点子,V9.33.02,,,http://gdown.baidu.com/data/wisegame/b691428fd35afd6f/70e0b691428fd35afd6f69d67a048d43.apk,http://gdown.baidu.com/img/0/512_512/786ff19ba16ae005f06a0fcd96c8d930.png,西南金点子，是西南证券专为广大股民提供的一款集行情、交易、资讯、理财为一体的股票/证券/理财/投资/金融/财经/炒股软件，是深受投资者欢迎的手机炒股、理财平台，为客户提供一站式综合理财服务。【重要功能】●行情：全行情覆盖，满足客户多层次需求●交易：委托站点全覆盖，普通两融全支持●资讯：全球资讯滚动直播，及时把握市场脉搏●理财：精选爆款理财产品，总有一款合适您...,否,安卓,2020-07-22 00:00:00,国信证券开户
132,2047,百度手机助手,华西证券大智慧,1.50,,,http://gdown.baidu.com/data/wisegame/a3d2f9ec2944e2d6/huaxizhengquandazhihui_20190104.apk,http://gdown.baidu.com/img/0/512_512/df2c68bb2939657e72f90c02eab4eec8.png,华西证券大智慧股票炒股软件是市场上深受股民欢迎的免费炒股(金融/投资/理财/证券)软件，实时行情、闪电交易、数据全面，从宏观到微观、板块到个股、仓位配比到操作建议等，助您控制风险，深挖股市价值。在线交易：兼具普通交易和闪电交易，普通股票包括股票买卖、新股申购、银证转账等交易功能满足您的投资所需；闪电交易，用户可在个股分时页快捷下单，节省超过约30%的下单时间，交易快人一步。闪电下单...,否,安卓,2020-07-22 00:00:00,国信证券开户
133,2048,百度手机助手,方德港美股,6.25.0,,,http://gdown.baidu.com/data/wisegame/b704109cdbf9e57a/eeb7b704109cdbf9e57a8e7db4eac203.apk,http://gdown.baidu.com/img/0/512_512/b783f0c5f781df84083ce447221c6c21.png,方德以卓越的专业水准和诚心的行业精神为根本，锐意进取，致力于为客户提供品种丰富的投资产品、稳定高校的交易平台和专业便捷的金融服务。为什么选择方德？【便捷】0资金门槛 当天极速开户【迅速】光纤毫秒传输速度 时刻与市场保持链接【全天候】美港A股实时行情 全天不间断播报【安全】登录交易双密码确认 呵护客户信息交易安全【市场监管】香港证监会严格监管 客户自己...,否,安卓,2020-07-22 00:00:00,国信证券开户
134,2049,百度手机助手,华彩人生,5.1.0,,,http://gdown.baidu.com/data/wisegame/ddc02a4485ec3807/6dadddc02a4485ec3807c47e83bcc4ed.apk,http://gdown.baidu.com/img/0/512_512/7397a04d864c4b59398327c1987bebaa.png,华西证券华彩人生是一款由华西证券股份有限公司为广大投资者打造的股票投资综合金融交易平台，集股票证券极速开户、股票交易购买、大盘行情、投资咨询、etf基金理财、国债投资、市场资讯等功能为一体的全方位金融软件。【基础功能】1、极速股票行情：沪深港美、全球行情尽在掌握，看股票、债券、基金、期货、外汇等一应俱全，十档行情快人一步；2、极速交易：股票、基金、债券等极速交易通道，委托方...,否,安卓,2020-07-22 00:00:00,国信证券开户
135,2050,百度手机助手,天风股票开户,2.5.2,,,http://gdown.baidu.com/data/wisegame/49ddff53bc605c71/9bd949ddff53bc605c71df13ee4e3310.apk,http://gdown.baidu.com/img/0/512_512/8edd378b26417c7252dc363643170105.png,介绍：天风证券官方出品的股票开户APP，上市券商品质。全程网上开户、信息安全、操作便捷！公司介绍：天风证券是经中国证监会批准成立的全国全牌照综合性证券公司，于2018年10月19日成功登陆A股资本市场，股票代码601162。公司注册资本达46.62亿元，总资产514.98亿元。在全国重点区域和城市设有15家分公司及近百家证券营业部，员工人数超过3000人。可...,否,安卓,2020-07-22 00:00:00,国信证券开户
136,2051,百度手机助手,华盛通港股美股,2.1.501,,,http://gdown.baidu.com/data/wisegame/c7714f1d5b9d0f2b/huashengtongganggumeigu_212.apk,http://gdown.baidu.com/img/0/512_512/24045fed909f8f39ea0bc1c38e0c3e3d.png,华盛通是新浪集团和微博旗下的港股、美股投资服务平台，为您提供便捷的线上开户和证券服务。華盛資本証券是创建于2010年的持牌券商(中央编号：AUL711)，持有香港证监会授予的1、2、4、9号牌照，严格遵循《证券及期货条例》的要求，为客户提供安全可靠的证券交易服务。户头由中国银行(香港)、香港交易所托管，资产全程隔离。为您提供的交易服务已从手机延伸至PC、Mac平台。已开启ETF、窝轮、牛熊证、融资...,否,安卓,2020-07-22 00:00:00,国信证券开户
137,2052,小米应用市场,国海证券开户,2.5.0,2020-06-22 00:00:00,国海证券股份有限公司,http://app.mi.com/download/885148?id=com.hundsun.obm.android.ghzq&amp;ref=search&amp;nonce=-7659945309523041671%3A26590006&amp;appClientId=2882303761517485445&amp;appSignature=lDNg4mdIVQLmStP0O5WxGSFu-NHKboNu7TulIGEeJc8,http://file.market.xiaomi.com/thumbnail/PNG/l114/AppStore/0ce23045916cb40733c500ef17969b7f0846033d5,国海开户APP是国海证券精心为客户打造的开户系统，免费、高效、便捷，客户只需准备身份证、银行卡，无需临柜，全程手机自助3分钟完成开户。开户就是这么简单！,否,安卓,2020-07-22 00:00:00,国信证券开户
138,2053,小米应用市场,海通证券开户,3.6.3,2019-10-23 00:00:00,海通证券股份有限公司,http://app.mi.com/download/430744?id=com.cairh.khapp.htsec.fuzhoulu&amp;ref=search&amp;nonce=-2191341878199009630%3A26590006&amp;appClientId=2882303761517485445&amp;appSignature=tyGF_OD_A1jSjnQ7uoZHzvnnqAj_W1q_kU7R2j0QthY,http://file.market.xiaomi.com/thumbnail/PNG/l114/AppStore/0107c94f214e046910906ea937d5e0ef91b3867fb,【股票开户】,否,安卓,2020-07-22 00:00:00,国信证券开户
139,2054,小米应用市场,万联证券股票开户,3.3.8,2020-04-22 00:00:00,万联证券股份有限公司,http://app.mi.com/download/537188?id=com.cairh.khapp.wanlian.pro&amp;ref=search&amp;nonce=-2609441799620522041%3A26590006&amp;appClientId=2882303761517485445&amp;appSignature=3JTuqSTrwWm5yefP44UwFQYw6tLWiJYPTJrCko0fcV0,http://file.market.xiaomi.com/thumbnail/PNG/l114/AppStore/04bc914b1703b48dc055ab023caee4df397169d1b,万联证券官方推出的一款手机炒股开户软件，为您提供安全、便捷的网上证券开户服务。免费开立沪深A股证券账户，尊享佣金费率万分之2.5，免费体验level-2增强行情，助您掘金大牛股！,否,安卓,2020-07-22 00:00:00,国信证券开户
140,2055,小米应用市场,浙商证券开户,3.3.8.2003121300,2020-04-15 00:00:00,浙商证券股份有限公司,http://app.mi.com/download/807381?id=com.cairh.khapp.stocke.h&amp;ref=search&amp;nonce=-7033921140178304301%3A26590006&amp;appClientId=2882303761517485445&amp;appSignature=dnX7ERgEa5pUvDkd7nXb3pnrpYAY9bwqehrsWh6JVbM,http://file.market.xiaomi.com/thumbnail/PNG/l114/AppStore/088472588d0dd437b2ce3788764d9daeea4a7b597,浙商证券手机开户是浙商证券推出的一款支持7×24小时、用户无需排队等待，可自助完成A股资金账户、沪深股东账户、沪深TA基金等账户新开户或转户的免费APP。APP体积小巧、运行快速，可随时随地下载办理开户。,否,安卓,2020-07-22 00:00:00,国信证券开户
141,2056,小米应用市场,江海证券开户,3.3.8.1812131502,2020-02-19 00:00:00,江海证券有限公司,http://app.mi.com/download/440209?id=com.cairh.khapp.jianghai&amp;ref=search&amp;nonce=-2763971548622083219%3A26590006&amp;appClientId=2882303761517485445&amp;appSignature=T8i0dguarNKOmjZwhhz43HxQOAJt9uJHT0NQjKpIByA,http://file.market.xiaomi.com/thumbnail/PNG/l114/AppStore/0916a05f78d484dcf3e307bd30117ea49a9c64231,【近期活动】,否,安卓,2020-07-22 00:00:00,国信证券开户
